Column1;Title;KBA;Resolution;class
220;Requires permission wifi access to the laptop;KBA000011;First, connect a network cable to your laptop to the red port on your workstation. Run ipconfig /all on your command prompt. Share WiFi Mac or Hardware address to the IT team. IT team then adds your MAC ID to enable WiFi access;34
221;System behaves strangely, blue screen appears in the middle;KBA000033;Press F8 button on system start, Choose safe mode, if OS loads then restart the os, if still same issue comes handover it to IT team;45
222;System showing a blue screen at startup;KBA000001;1. Hold the power button until system gets shut down, then hit the power button to boot the machine. If still blue screen appears contact IT team and surrender the laptop.;32
223;The account was blocked due to 3 wrong password attempts. Could you please reset the password?;KBA000042;Unlocked the account and new password is sent to your email id.;47
224;The computer will not turn on;KBA000008;Contact IT support.;33
225;The desktop is not working;KBA000028;Please check the Power cables are properly plugged , Please write back to us if the Problem still persists.;40
226;The system hangs at startup with a blue screen;KBA000033;Press F8 button on system start, Choose safe mode, if OS loads then restart the os, if still same issue comes handover it to IT team;45
227;The wheel on my mouse is not working properly, what am I doing?;KBA000020;If you're running any version of Microsoft Windows and are encountering issues with the mouse wheel, first attempt to adjust the mouse settings through the Mouse Properties window. This window can be accessed by opening the Control Panel and double-clicking the Mouse icon.;10
228;There are black borders on my screen, what am I doing?;KBA000017;"If the resolution was recently changed it is possible for the monitor to not auto adjust or shift to the correct size. If this occurs, the resolution can be changed back to the original setting or you can manually adjust the monitor. If a black border exists on the monitor it can generally be resolved by manually adjusting the horizontal or vertical width. Because each monitor is different, the method of adjusting this setting will vary; consult your monitor documentation.";8
229;There is no display on the monitor, what am I doing now?;KBA000024;Make sure the monitor is on. If no power light (green or orange light) is seen on the monitor display try pressing the power button until it comes on. If your computer monitor was on and you stepped away from the computer and upon returning it was black, it's likely that the computer is asleep. Try moving your mouse, clicking the mouse buttons, and/or pressing any key (space bar) on the keyboard to wake it up. Make sure that the monitor is connected properly to the back of the computer.;14
230;What do I do if my computer crashes?;KBA000037;"There are many reasons why a computer may just stop working or ""freeze"". Most of the time there isn't much we can do about it, it is a fact of life that computer programs have become so complex that occasionally users will experience problems even when performing common tasks. When your computer no longer responds to keyboard commands your best bet is to restart the computer.";21
231;What do I do if my hard drive does not work?;KBA000004;As with most computer errors, your first step is to shut down your computer and restart it. This will help you determine whether or not you actually have a hard disk problem. If the disk is severely damaged then your computer will probably fail to restart properly. If this is the case then contact MCWare IT Solutions, this is a job for the professionals.;2
232;What do I do if the image on the screen is distorted or distorted?;KBA000050;You may receive a distorted image when the cable is loose or defective. Disconnect the video cable going from the back of the computer and verify that no pins are bent, burnt or broken. Once verified re-connect the monitor cable. If the refresh rate is not properly set the monitor may have a wavy or an appearance that lines are going down or across the monitor slowly or fast, this may also cause a flickering affect. A distorted image can be caused by magnetic or other types of interference. Verify no speakers, fans or other magnetic devices are close to the monitor.;31
233;What is a computer virus?;KBA000002;A computer virus is a software program that has been intentionally created to cause a user grief, spread to other computers, or destroy data on an individual's computer. To help prevent a computer from becoming infected by a virus, software developers have developed anti virus programs that stay active on the computer helping to protect it. It is important to realize that many computers do not come pre-loaded with these already installed and that if computers do come with these programs, the programs may expire within 90 days.;0
234;Why does my mouse behave unpredictably?;KBA000044;Users who have an optical mechanical mouse (most common mouse for desktop computers) are likely experiencing erratic behaviour because the mouse is not clean or is dirty. If you've cleaned the mouse and continue to encounter issues and this mouse has worked in the past fine unfortunately your mouse is likely defective. One additional test that can be done to help determine if this is the case or not is to connect the mouse to another computer. Otherwise we suggest replacing the mouse.;26
235;Wi-Fi access required.;KBA000011;First, connect a network cable to your laptop to the red port on your workstation. Run ipconfig /all on your command prompt. Share WiFi Mac or Hardware address to the IT team. IT team then adds your MAC ID to enable WiFi access;34
